{
  "상담ID": "dummy_03",
  "분류": {
    "상담유형": "해지·환급",
    "유형근거": "U02: '저 보험 해지하려고요. 급하게 돈이 좀 필요해서요.'",
    "권유유형": "유지·해지방어·승환",
    "권유근거": "U07: '지금 해지하시면 좀 아까운데요, 더 유지하시는 게 훨씬 나으세요.' / U13: '근데 진짜 해지 안 하시는 게 낫거든요.'"
  },
  "항목평가": [
    {
      "항목코드": "A1",
      "충족수준": "충족",
      "배점": 4,
      "획득점수": 4,
      "근거": [
        {
          "대화ID": "U01",
          "인용문": "네 안녕하세요, 한빛생명 고객센터 상담사 박소영입니다. 무엇을 도와드릴까요?"
        }
      ]
    },
    {
      "항목코드": "A2",
      "충족수준": "충족",
      "배점": 4,
      "획득점수": 4,
      "근거": [
        {
          "대화ID": "U03",
          "인용문": "성함이랑 생년월일 먼저 확인해드릴게요."
        },
        {
          "대화ID": "U05",
          "인용문": "최영호 고객님 맞으시죠. 확인됐습니다."
        }
      ]
    },
    {
      "항목코드": "A3",
      "충족수준": "충족",
      "배점": 4,
      "획득점수": 4,
      "근거": [
        {
          "대화ID": "U02",
          "인용문": "네, 저 보험 해지하려고요. 급하게 돈이 좀 필요해서요."
        },
        {
          "대화ID": "U03",
          "인용문": "아 그렇군요. 어떤 상품 해지 문의이신가요?"
        }
      ]
    },
    {
      "항목코드": "B1",
      "충족수준": "미충족",
      "배점": 8,
      "획득점수": 0,
      "근거": [
        {
          "대화ID": "U09",
          "인용문": "뭐, 3년 정도 드셨으면 크게 손해는 아니세요. 납입하신 거에서 많이 돌려받으실 수 있고요. 큰 불이익은 없어요."
        },
        {
          "대화ID": "U11",
          "인용문": "거의 다 돌려받으세요. 사업비를 좀 떼긴 하는데 그게 크지 않아요."
        },
        {
          "대화ID": "U15",
          "인용문": "7년쯤 되면 확 좋아지거든요. 뭐 그래도 지금 해지하셔도 큰 손해는 없으시긴 해요."
        }
      ]
    },
    {
      "항목코드": "B2",
      "충족수준": "미충족",
      "배점": 6,
      "획득점수": 0,
      "근거": [
        {
          "대화ID": "U11",
          "인용문": "사업비를 좀 떼긴 하는데 그게 크지 않아요."
        }
      ]
    },
    {
      "항목코드": "B3",
      "충족수준": "미충족",
      "배점": 6,
      "획득점수": 0,
      "근거": [
        {
          "대화ID": "U02",
          "인용문": "네, 저 보험 해지하려고요. 급하게 돈이 좀 필요해서요."
        },
        {
          "대화ID": "U08",
          "인용문": "그래도 급하게 필요해서요. 얼마나 받을 수 있어요?"
        }
      ]
    },
    {
      "항목코드": "B4",
      "충족수준": "미충족",
      "배점": 6,
      "획득점수": 0,
      "근거": [
        {
          "대화ID": "U07",
          "인용문": "음… 지금 해지하시면 좀 아까운데요, 더 유지하시는 게 훨씬 나으세요."
        },
        {
          "대화ID": "U13",
          "인용문": "네, 도와드릴 수 있는데요. 근데 진짜 해지 안 하시는 게 낫거든요. 지금까지 3년이나 내셨는데 좀 더 하시면 훨씬 많이 받으세요."
        }
      ]
    },
    {
      "항목코드": "C1",
      "충족수준": "부분충족",
      "배점": 6,
      "획득점수": 3,
      "근거": [
        {
          "대화ID": "U03",
          "인용문": "아 그렇군요."
        },
        {
          "대화ID": "U07",
          "인용문": "아, 한빛 종신보험이시군요. 3년 납입하셨구나. 음… 지금 해지하시면 좀 아까운데요, 더 유지하시는 게 훨씬 나으세요."
        }
      ]
    },
    {
      "항목코드": "C2",
      "충족수준": "충족",
      "배점": 6,
      "획득점수": 6,
      "근거": [
        {
          "대화ID": "U01",
          "인용문": "네 안녕하세요, 한빛생명 고객센터 상담사 박소영입니다. 무엇을 도와드릴까요?"
        },
        {
          "대화ID": "U19",
          "인용문": "네, 감사합니다. 또 필요하신 거 있으면 연락 주세요."
        }
      ]
    },
    {
      "항목코드": "C3",
      "충족수준": "해당없음",
      "배점": 6,
      "획득점수": 0,
      "근거": []
    },
    {
      "항목코드": "D1",
      "충족수준": "해당없음",
      "배점": 7,
      "획득점수": 0,
      "근거": []
    },
    {
      "항목코드": "D2",
      "충족수준": "해당없음",
      "배점": 5,
      "획득점수": 0,
      "근거": []
    },
    {
      "항목코드": "D3",
      "충족수준": "해당없음",
      "배점": 5,
      "획득점수": 0,
      "근거": []
    },
    {
      "항목코드": "D4",
      "충족수준": "해당없음",
      "배점": 4,
      "획득점수": 0,
      "근거": []
    },
    {
      "항목코드": "D5",
      "충족수준": "해당없음",
      "배점": 4,
      "획득점수": 0,
      "근거": []
    },
    {
      "항목코드": "D6",
      "충족수준": "미충족",
      "배점": 5,
      "획득점수": 0,
      "근거": [
        {
          "대화ID": "U09",
          "인용문": "뭐, 3년 정도 드셨으면 크게 손해는 아니세요. 납입하신 거에서 많이 돌려받으실 수 있고요. 큰 불이익은 없어요."
        },
        {
          "대화ID": "U11",
          "인용문": "거의 다 돌려받으세요. 사업비를 좀 떼긴 하는데 그게 크지 않아요."
        },
        {
          "대화ID": "U15",
          "인용문": "7년쯤 되면 확 좋아지거든요. 뭐 그래도 지금 해지하셔도 큰 손해는 없으시긴 해요."
        }
      ]
    },
    {
      "항목코드": "E1",
      "충족수준": "부분충족",
      "배점": 7,
      "획득점수": 3.5,
      "근거": [
        {
          "대화ID": "U17",
          "인용문": "네, 알겠습니다. 해지 신청 진행해드릴게요. 환급금은 신청 후 3영업일 이내에 등록 계좌로 입금돼요."
        }
      ]
    },
    {
      "항목코드": "E2",
      "충족수준": "부분충족",
      "배점": 7,
      "획득점수": 3.5,
      "근거": [
        {
          "대화ID": "U19",
          "인용문": "네, 감사합니다. 또 필요하신 거 있으면 연락 주세요."
        }
      ]
    }
  ],
  "판매정보": null,
  "위험플래그": [
    {
      "규칙번호": 1,
      "관련항목코드": "D6",
      "근거": "U09: '크게 손해는 아니세요.' / U11: '거의 다 돌려받으세요.' — 3년 납입 종신보험의 해지환급률은 38%로, 이는 명백한 허위·과장 안내에 해당합니다."
    },
    {
      "규칙번호": 3,
      "관련항목코드": "B1",
      "근거": "U09: '크게 손해는 아니세요.' / U11: '거의 다 돌려받으세요.' — 3년 납입 종신보험의 해지환급률은 38%로, 이는 명백히 잘못된 정보 안내입니다."
    },
    {
      "규칙번호": 5,
      "근거": "D영역 득점률 0% (기준 50% 미만)"
    }
  ],
  "집계": {
    "원점수합": 28,
    "적용배점합": 69,
    "환산총점": 40.6,
    "위험표시여부": true,
    "상태라벨": "불완전판매 의심"
  },
  "고객만족": {
    "등급": "불만족",
    "점수": null,
    "근거": "고객은 급하게 돈이 필요하여 해지를 요청했으나, 상담사는 해지환급금에 대해 '크게 손해는 아니세요', '거의 다 돌려받으세요' 등 사실과 다른 과장된 정보를 반복적으로 안내하여 고객의 합리적인 판단을 저해했습니다. 또한, 해지를 막으려는 시도만 반복하고 보험계약대출과 같은 대안을 전혀 제시하지 않아 고객의 니즈를 적극적으로 해결하려는 노력이 부족했습니다."
  },
  "요약": "고객은 급전 마련을 위해 종신보험 해지를 요청했습니다. 상담사는 해지환급금에 대해 사실과 다른 과장된 정보를 제공하며 해지를 만류했으나, 고객의 니즈를 해결할 수 있는 보험계약대출 등의 대안은 제시하지 않았습니다. 결국 고객의 요청대로 해지 절차를 진행했습니다.",
  "종합피드백": "상담사는 고객의 해지 요청에 대해 유지 권유를 하는 과정에서 해지환급금에 대한 정보를 심각하게 과장하여 안내했습니다. 3년 납입 종신보험의 해지환급률이 38%임에도 불구하고 '크게 손해는 아니세요', '거의 다 돌려받으세요'와 같은 표현은 명백한 오정보 및 부당 권유에 해당합니다. 또한, 고객이 '급하게 돈이 필요하다'고 명확히 밝혔음에도 불구하고 보험계약대출과 같은 실질적인 대안을 전혀 제시하지 않고 단순히 해지를 만류하는 데 그쳐 적극적인 문제 해결 노력이 부족했습니다. 전문용어인 '사업비'에 대한 설명도 누락되었습니다. 상담 품질 향상을 위해 정보의 정확성 확보와 고객 니즈에 맞는 대안 제시 역량 강화가 시급합니다.",
  "평가메타": {
    "평가주체": "AI_1차",
    "AI모델": "gemini-2.5-flash",
    "루브릭버전": "v1.5",
    "평가일시": "2026-07-04T04:29:56.170Z"
  }
}