{
  "상담ID": "dummy_07",
  "분류": {
    "상담유형": "신규·보장",
    "유형근거": "고객이 건강보험 가입을 문의하고 상담사가 상품을 안내하며 청약 절차를 진행했습니다.",
    "권유유형": "신규판매",
    "권유근거": "고객이 건강보험 가입을 문의했고, 상담사가 '한빛 건강보험'을 안내하며 청약서 링크를 보내는 등 신규 상품 판매를 진행했습니다."
  },
  "항목평가": [
    {
      "항목코드": "A1",
      "충족수준": "충족",
      "배점": 4,
      "획득점수": 4,
      "근거": [
        {
          "대화ID": "U01",
          "인용문": "네, 한빛생명 고객센터 상담사 김도연입니다. 무엇을 도와드릴까요?"
        }
      ]
    },
    {
      "항목코드": "A2",
      "충족수준": "미충족",
      "배점": 4,
      "획득점수": 0,
      "근거": [
        {
          "대화ID": "U05",
          "인용문": "실례지만 연세가 어떻게 되실까요?"
        }
      ]
    },
    {
      "항목코드": "A3",
      "충족수준": "충족",
      "배점": 4,
      "획득점수": 4,
      "근거": [
        {
          "대화ID": "U02",
          "인용문": "아 네, 건강보험 하나 알아보려고요. 암보험 같은 거요."
        },
        {
          "대화ID": "U04",
          "인용문": "그냥 큰 병이요. 요새 주변에 암 걸린 사람도 있고 해서… 나이도 있고."
        },
        {
          "대화ID": "U03",
          "인용문": "네, 건강보험 문의 주셨네요. 혹시 특별히 대비하고 싶으신 부분이 있으실까요? 암이라든지 입원이라든지요."
        }
      ]
    },
    {
      "항목코드": "B1",
      "충족수준": "충족",
      "배점": 8,
      "획득점수": 8,
      "근거": [
        {
          "대화ID": "U07",
          "인용문": "네, 그러면 저희 한빛 건강보험 안내해 드릴게요. 암 진단비가 일반암 기준 3천만 원 나오고요, 뇌졸중이나 심근경색도 각각 2천만 원씩 보장됩니다. 입원하시면 하루 3만 원씩 나오고요."
        },
        {
          "대화ID": "U09",
          "인용문": "마흔셋이시면… 남자분이시죠? 한 7만 4천 원 정도 보시면 됩니다. 80세까지 보장되고 20년 납입이세요."
        },
        {
          "대화ID": "U11",
          "인용문": "네, 가입은 바로 되시는데, 암 진단비는 가입일로부터 90일 지나야 보장이 시작돼요. 그 안에 진단받으시면 안 나오세요."
        }
      ]
    },
    {
      "항목코드": "B2",
      "충족수준": "충족",
      "배점": 6,
      "획득점수": 6,
      "근거": [
        {
          "대화ID": "U11",
          "인용문": "네, 가입은 바로 되시는데, 암 진단비는 가입일로부터 90일 지나야 보장이 시작돼요. 그 안에 진단받으시면 안 나오세요."
        }
      ]
    },
    {
      "항목코드": "B3",
      "충족수준": "충족",
      "배점": 6,
      "획득점수": 6,
      "근거": [
        {
          "대화ID": "U19",
          "인용문": "제가 청약서 링크 문자로 보내드릴게요. 작성하시고 보내주시면 됩니다."
        }
      ]
    },
    {
      "항목코드": "B4",
      "충족수준": "충족",
      "배점": 6,
      "획득점수": 6,
      "근거": [
        {
          "대화ID": "U01",
          "인용문": "네, 한빛생명 고객센터 상담사 김도연입니다. 무엇을 도와드릴까요?"
        }
      ]
    },
    {
      "항목코드": "C1",
      "충족수준": "부분충족",
      "배점": 6,
      "획득점수": 3,
      "근거": [
        {
          "대화ID": "U05",
          "인용문": "아 네, 그러시군요. 실례지만 연세가 어떻게 되실까요?"
        },
        {
          "대화ID": "U15",
          "인용문": "아 그러시구나. 그런 건 청약서 작성하실 때 알려주시면 돼요."
        }
      ]
    },
    {
      "항목코드": "C2",
      "충족수준": "충족",
      "배점": 6,
      "획득점수": 6,
      "근거": [
        {
          "대화ID": "U01",
          "인용문": "네, 한빛생명 고객센터 상담사 김도연입니다. 무엇을 도와드릴까요?"
        }
      ]
    },
    {
      "항목코드": "C3",
      "충족수준": "해당없음",
      "배점": 6,
      "획득점수": 0,
      "근거": []
    },
    {
      "항목코드": "D1",
      "충족수준": "부분충족",
      "배점": 7,
      "획득점수": 3.5,
      "근거": [
        {
          "대화ID": "U07",
          "인용문": "네, 그러면 저희 한빛 건강보험 안내해 드릴게요. 암 진단비가 일반암 기준 3천만 원 나오고요, 뇌졸중이나 심근경색도 각각 2천만 원씩 보장됩니다. 입원하시면 하루 3만 원씩 나오고요."
        },
        {
          "대화ID": "U09",
          "인용문": "마흔셋이시면… 남자분이시죠? 한 7만 4천 원 정도 보시면 됩니다. 80세까지 보장되고 20년 납입이세요."
        }
      ]
    },
    {
      "항목코드": "D2",
      "충족수준": "부분충족",
      "배점": 5,
      "획득점수": 2.5,
      "근거": [
        {
          "대화ID": "U02",
          "인용문": "아 네, 건강보험 하나 알아보려고요. 암보험 같은 거요."
        },
        {
          "대화ID": "U04",
          "인용문": "그냥 큰 병이요. 요새 주변에 암 걸린 사람도 있고 해서… 나이도 있고."
        },
        {
          "대화ID": "U07",
          "인용문": "네, 그러면 저희 한빛 건강보험 안내해 드릴게요. 암 진단비가 일반암 기준 3천만 원 나오고요, 뇌졸중이나 심근경색도 각각 2천만 원씩 보장됩니다. 입원하시면 하루 3만 원씩 나오고요."
        }
      ]
    },
    {
      "항목코드": "D3",
      "충족수준": "부분충족",
      "배점": 5,
      "획득점수": 2.5,
      "근거": [
        {
          "대화ID": "U15",
          "인용문": "아 그러시구나. 그런 건 청약서 작성하실 때 알려주시면 돼요. 기존에 치료받으신 거 있으면 적어주셔야 하고요."
        },
        {
          "대화ID": "U17",
          "인용문": "음, 나중에 문제 생길 수 있으니까 그냥 사실대로 적어주시는 게 좋아요."
        }
      ]
    },
    {
      "항목코드": "D4",
      "충족수준": "충족",
      "배점": 4,
      "획득점수": 4,
      "근거": [
        {
          "대화ID": "U11",
          "인용문": "네, 가입은 바로 되시는데, 암 진단비는 가입일로부터 90일 지나야 보장이 시작돼요. 그 안에 진단받으시면 안 나오세요."
        }
      ]
    },
    {
      "항목코드": "D5",
      "충족수준": "부분충족",
      "배점": 4,
      "획득점수": 2,
      "근거": [
        {
          "대화ID": "U19",
          "인용문": "아 그리고 가입하시고 15일 안에는 마음 바뀌시면 철회도 가능하세요."
        }
      ]
    },
    {
      "항목코드": "D6",
      "충족수준": "미충족",
      "배점": 5,
      "획득점수": 0,
      "근거": [
        {
          "대화ID": "U13",
          "인용문": "네. 뭐 보통 그 안에 무슨 일 있으실 일은 잘 없으니까요."
        }
      ]
    },
    {
      "항목코드": "E1",
      "충족수준": "충족",
      "배점": 7,
      "획득점수": 7,
      "근거": [
        {
          "대화ID": "U21",
          "인용문": "더 궁금하신 점 있으시면 고객센터로 연락 주세요. 감사합니다."
        }
      ]
    },
    {
      "항목코드": "E2",
      "충족수준": "충족",
      "배점": 7,
      "획득점수": 7,
      "근거": [
        {
          "대화ID": "U21",
          "인용문": "더 궁금하신 점 있으시면 고객센터로 연락 주세요. 감사합니다."
        }
      ]
    }
  ],
  "판매정보": {
    "권유상품코드": "P6",
    "권유상품명": "한빛 건강보험",
    "니즈시나리오코드": "N6",
    "확인절차": {
      "가입목적": true,
      "재정상황": false,
      "기존계약": false
    },
    "매칭판정": "적합",
    "판정근거": "고객이 암 등 큰 병에 대한 의료비 보장을 원했고(N6), 상담사는 한빛 건강보험(P6)을 권유하여 니즈에 적합합니다."
  },
  "위험플래그": [
    {
      "규칙번호": 1,
      "관련항목코드": "D6",
      "근거": "U13: '네. 뭐 보통 그 안에 무슨 일 있으실 일은 잘 없으니까요.' — 암 진단비 면책기간의 중요성을 축소하여 부당권유에 해당합니다."
    },
    {
      "규칙번호": 5,
      "근거": "D영역 득점률 48.3% (기준 50% 미만)"
    }
  ],
  "집계": {
    "원점수합": 71.5,
    "적용배점합": 94,
    "환산총점": 76.1,
    "위험표시여부": true,
    "상태라벨": "불완전판매 의심"
  },
  "고객만족": {
    "등급": "만족",
    "점수": null,
    "근거": "고객은 상담사의 안내에 대해 긍정적인 반응을 보였고(U10: '음, 그 정도면 괜찮네.'), 청약 절차를 진행하려는 의사를 밝혔습니다(U18: '알겠어요. 그럼 어떻게 가입해요?')."
  },
  "요약": "고객은 건강보험 가입을 문의했고, 상담사는 '한빛 건강보험'의 보장내용, 보험료, 보험기간, 암 진단비 면책기간 등을 안내했습니다. 고객의 기존 질병 고지의무와 청약철회 가능 기간도 설명했습니다. 상담사는 청약서 링크를 문자로 보내며 상담을 마무리했습니다.",
  "종합피드백": "상담사는 고객의 니즈를 정확히 파악하고 상품 정보를 대체로 정확하게 안내했습니다. 특히 암 진단비 면책기간에 대한 설명은 명확했습니다. 그러나 고객 본인확인 절차가 미흡했고, 고지의무 위반 시 불이익에 대한 설명이 '나중에 문제 생길 수 있다'는 식으로 추상적이었습니다. 또한, 해지환급금 및 해피콜 안내가 누락되어 중요사항 설명의무와 청약철회·해피콜 안내 항목에서 부분충족을 받았습니다. 가장 큰 문제점은 암 진단비 면책기간 설명 후 '보통 그 안에 무슨 일 있으실 일은 잘 없으니까요'와 같이 중요성을 축소하는 발언으로, 이는 부당권유에 해당하여 D6 항목에서 미충족 처리되었습니다.",
  "평가메타": {
    "평가주체": "AI_1차",
    "AI모델": "gemini-2.5-flash",
    "루브릭버전": "v1.5",
    "평가일시": "2026-07-04T04:54:27.653Z"
  }
}