{
  "상담ID": "dummy_04",
  "분류": {
    "상담유형": "보험금청구",
    "유형근거": "U02: '아 제가 얼마 전에 입원해서 수술을 받았는데요, 보험금 청구를 어떻게 하는지 몰라서요.'",
    "권유유형": "없음",
    "권유근거": "상담 전반에 걸쳐 신규 판매, 유지, 해지 방어, 승환 등 어떠한 형태의 권유도 없었음. 오직 보험금 청구 절차 안내만 이루어짐."
  },
  "항목평가": [
    {
      "항목코드": "A1",
      "충족수준": "충족",
      "배점": 4,
      "획득점수": 4,
      "근거": [
        {
          "대화ID": "U01",
          "인용문": "네, 안녕하세요. 한빛생명 고객센터 상담사 정유나입니다. 무엇을 도와드릴까요?"
        }
      ]
    },
    {
      "항목코드": "A2",
      "충족수준": "충족",
      "배점": 4,
      "획득점수": 4,
      "근거": [
        {
          "대화ID": "U05",
          "인용문": "본인 확인을 위해 성함하고 생년월일 부탁드릴게요."
        },
        {
          "대화ID": "U07",
          "인용문": "장우현 고객님 확인됐습니다."
        }
      ]
    },
    {
      "항목코드": "A3",
      "충족수준": "충족",
      "배점": 4,
      "획득점수": 4,
      "근거": [
        {
          "대화ID": "U02",
          "인용문": "아 제가 얼마 전에 입원해서 수술을 받았는데요, 보험금 청구를 어떻게 하는지 몰라서요."
        },
        {
          "대화ID": "U07",
          "인용문": "가입하신 한빛 건강보험으로 입원일당하고 수술비 청구하시는 거 맞으실까요?"
        },
        {
          "대화ID": "U08",
          "인용문": "네 맞아요. 한 8일 입원했고 수술도 했어요."
        }
      ]
    },
    {
      "항목코드": "B1",
      "충족수준": "충족",
      "배점": 8,
      "획득점수": 8,
      "근거": [
        {
          "대화ID": "U09",
          "인용문": "입원일당은 하루 3만 원씩 입원하신 일수만큼 지급되고요, 수술비는 수술 종류에 따라 정해진 금액으로 지급됩니다."
        },
        {
          "대화ID": "U13",
          "인용문": "서류 접수되면 영업일 기준 3일 이내에 지급됩니다. 혹시 지급이 늦어지면 연체이자가 더해져서 나갑니다."
        }
      ]
    },
    {
      "항목코드": "B2",
      "충족수준": "충족",
      "배점": 6,
      "획득점수": 6,
      "근거": [
        {
          "대화ID": "U09",
          "인용문": "입원일당은 하루 3만 원씩 입원하신 일수만큼 지급되고요, 수술비는 수술 종류에 따라 정해진 금액으로 지급됩니다."
        }
      ]
    },
    {
      "항목코드": "B3",
      "충족수준": "충족",
      "배점": 6,
      "획득점수": 6,
      "근거": [
        {
          "대화ID": "U09",
          "인용문": "청구하시려면 진단서, 입퇴원확인서, 수술확인서, 그리고 진료비 영수증을 준비해 주시면 됩니다."
        },
        {
          "대화ID": "U11",
          "인용문": "발급이 어려우시면 제가 단계별로 안내해 드릴게요."
        }
      ]
    },
    {
      "항목코드": "B4",
      "충족수준": "충족",
      "배점": 6,
      "획득점수": 6,
      "근거": [
        {
          "대화ID": "U01",
          "인용문": "네, 안녕하세요. 한빛생명 고객센터 상담사 정유나입니다. 무엇을 도와드릴까요?"
        },
        {
          "대화ID": "U19",
          "인용문": "네, 얼른 쾌차하시길 바랍니다. 추가로 궁금하신 점 생기시면 언제든 고객센터로 연락 주세요. 감사합니다."
        }
      ]
    },
    {
      "항목코드": "C1",
      "충족수준": "충족",
      "배점": 6,
      "획득점수": 6,
      "근거": [
        {
          "대화ID": "U03",
          "인용문": "아이고, 수술까지 받으셨군요. 지금 몸은 좀 어떠세요?"
        },
        {
          "대화ID": "U05",
          "인용문": "고생 많으셨습니다. 빨리 회복하셔야 할 텐데요."
        },
        {
          "대화ID": "U11",
          "인용문": "번거로우시죠."
        }
      ]
    },
    {
      "항목코드": "C2",
      "충족수준": "충족",
      "배점": 6,
      "획득점수": 6,
      "근거": [
        {
          "대화ID": "U01",
          "인용문": "네, 안녕하세요. 한빛생명 고객센터 상담사 정유나입니다. 무엇을 도와드릴까요?"
        },
        {
          "대화ID": "U19",
          "인용문": "네, 얼른 쾌차하시길 바랍니다. 추가로 궁금하신 점 생기시면 언제든 고객센터로 연락 주세요. 감사합니다."
        }
      ]
    },
    {
      "항목코드": "C3",
      "충족수준": "충족",
      "배점": 6,
      "획득점수": 6,
      "근거": [
        {
          "대화ID": "U05",
          "인용문": "고생 많으셨습니다. 빨리 회복하셔야 할 텐데요."
        },
        {
          "대화ID": "U11",
          "인용문": "번거로우시죠. 다만 심사에 꼭 필요한 서류라서요, 병원 원무과에서 한 번에 떼실 수 있습니다. 발급이 어려우시면 제가 단계별로 안내해 드릴게요."
        }
      ]
    },
    {
      "항목코드": "D1",
      "충족수준": "해당없음",
      "배점": 7,
      "획득점수": 0,
      "근거": []
    },
    {
      "항목코드": "D2",
      "충족수준": "해당없음",
      "배점": 5,
      "획득점수": 0,
      "근거": []
    },
    {
      "항목코드": "D3",
      "충족수준": "해당없음",
      "배점": 5,
      "획득점수": 0,
      "근거": []
    },
    {
      "항목코드": "D4",
      "충족수준": "해당없음",
      "배점": 4,
      "획득점수": 0,
      "근거": []
    },
    {
      "항목코드": "D5",
      "충족수준": "해당없음",
      "배점": 4,
      "획득점수": 0,
      "근거": []
    },
    {
      "항목코드": "D6",
      "충족수준": "해당없음",
      "배점": 5,
      "획득점수": 0,
      "근거": []
    },
    {
      "항목코드": "E1",
      "충족수준": "충족",
      "배점": 7,
      "획득점수": 7,
      "근거": [
        {
          "대화ID": "U17",
          "인용문": "정리해 드리면, 진단서·입퇴원확인서·수술확인서·영수증 준비하셔서 앱이나 팩스로 접수, 접수 후 3영업일 내 지급입니다. 더 궁금하신 점 있으실까요?"
        }
      ]
    },
    {
      "항목코드": "E2",
      "충족수준": "충족",
      "배점": 7,
      "획득점수": 7,
      "근거": [
        {
          "대화ID": "U19",
          "인용문": "네, 얼른 쾌차하시길 바랍니다. 추가로 궁금하신 점 생기시면 언제든 고객센터로 연락 주세요. 감사합니다."
        }
      ]
    }
  ],
  "판매정보": null,
  "위험플래그": [],
  "집계": {
    "원점수합": 70,
    "적용배점합": 70,
    "환산총점": 100,
    "위험표시여부": false,
    "상태라벨": "정상"
  },
  "고객만족": {
    "등급": "만족",
    "점수": null,
    "근거": "고객은 상담사의 안내에 대해 '잘 알겠습니다. 감사합니다.' (U18)라고 긍정적으로 반응했으며, 상담사는 고객의 불편함에 공감하고 필요한 정보를 정확하게 제공하여 만족스러운 경험을 제공했습니다."
  },
  "요약": "고객의 보험금 청구 문의에 대해 상담사가 친절하고 정확하게 필요 서류와 절차, 지급 기한 등을 안내하고 마무리까지 완벽하게 처리한 상담입니다.",
  "종합피드백": "고객의 불편함에 공감하며 필요한 정보를 정확하고 명확하게 안내했습니다. 특히 서류 준비의 번거로움에 대한 공감과 추가 지원 의사 표명, 그리고 마무리 요약 및 추가 문의 채널 안내까지 전반적으로 매우 우수한 상담이었습니다.",
  "평가메타": {
    "평가주체": "AI_1차",
    "AI모델": "gemini-2.5-flash",
    "루브릭버전": "v1.5",
    "평가일시": "2026-07-04T04:49:45.278Z"
  }
}