{
  "상담ID": "dummy_01",
  "분류": {
    "상담유형": "신규·보장",
    "유형근거": "고객이 자녀 교육비 마련을 위해 보험 가입을 문의함 (U02: \"보험 하나 가입할까 해서요. 애 교육비 때문에.\")",
    "권유유형": "신규판매",
    "권유근거": "상담사가 고객의 니즈에 맞춰 한빛 저축보험(P3) 가입을 권유함 (U13: \"원금을 지키면서 모으고 싶으시다면 저희 한빛 저축보험이 잘 맞을 것 같아요.\")"
  },
  "항목평가": [
    {
      "항목코드": "A1",
      "충족수준": "충족",
      "배점": 4,
      "획득점수": 4,
      "근거": [
        {
          "대화ID": "U01",
          "인용문": "네, 안녕하세요. 한빛생명 고객센터 상담사 이지현입니다. 무엇을 도와드릴까요?"
        }
      ]
    },
    {
      "항목코드": "A2",
      "충족수준": "충족",
      "배점": 4,
      "획득점수": 4,
      "근거": [
        {
          "대화ID": "U03",
          "인용문": "먼저 본인 확인 좀 드려도 될까요? 성함이랑 생년월일 말씀해주시겠어요?"
        },
        {
          "대화ID": "U05",
          "인용문": "네, 김수연 고객님 확인됐습니다."
        }
      ]
    },
    {
      "항목코드": "A3",
      "충족수준": "충족",
      "배점": 4,
      "획득점수": 4,
      "근거": [
        {
          "대화ID": "U03",
          "인용문": "네, 자녀분 교육비 목적으로 알아보시는 거군요."
        },
        {
          "대화ID": "U05",
          "인용문": "교육비 목적이라고 하셨는데, 아이가 지금 몇 살이고 언제쯤 쓰실 생각이세요?"
        },
        {
          "대화ID": "U07",
          "인용문": "혹시 그 전에 급하게 목돈 쓰실 일은 없으신가요?"
        },
        {
          "대화ID": "U09",
          "인용문": "원금이 좀 줄어드는 건 괜찮으신 편인가요, 아니면 납입하신 금액은 지켜지길 원하세요?"
        },
        {
          "대화ID": "U11",
          "인용문": "혹시 지금 한빛생명이나 다른 곳에 가입된 보험이 있으신가요?"
        }
      ]
    },
    {
      "항목코드": "B1",
      "충족수준": "충족",
      "배점": 8,
      "획득점수": 8,
      "근거": [
        {
          "대화ID": "U13",
          "인용문": "원금을 지키면서 모으고 싶으시다면 저희 한빛 저축보험이 잘 맞을 것 같아요. 원금보장형 상품이거든요. 이 상품은 만기가 10년이라"
        },
        {
          "대화ID": "U15",
          "인용문": "공시이율이라고 해서요, 시장 상황에 따라 조금씩 달라지는 이율이 있는데 지금 연 3.0%로 운용돼요. 최소 1.0%는 보증이 돼서 원금 손실은 없고요."
        },
        {
          "대화ID": "U17",
          "인용문": "월 30만 원이나 50만 원 중에 고르실 수 있어요. 30만 원 기준으로 보시면 만기에 원금 플러스 이자 수령하시는 거고, 혹시 기간 중에 사망하시는 경우엔 기납입 보험료의 101%가 지급돼요."
        },
        {
          "대화ID": "U19",
          "인용문": "중간에 해지하시면 납입하신 금액보다 적게 받으실 수 있어요. 3년 시점에 해지하시면 납입액의 약 82% 수준이고요, 7년은 돼야 원금 수준으로 올라와요."
        },
        {
          "대화ID": "U23",
          "인용문": "저축보험은 면책기간은 따로 없어요. 다만 고의나 자해로 인한 사고는 보험금이 지급이 안 되는 경우가 있고요"
        }
      ]
    },
    {
      "항목코드": "B2",
      "충족수준": "충족",
      "배점": 6,
      "획득점수": 6,
      "근거": [
        {
          "대화ID": "U15",
          "인용문": "공시이율이라고 해서요, 시장 상황에 따라 조금씩 달라지는 이율이 있는데 지금 연 3.0%로 운용돼요."
        },
        {
          "대화ID": "U21",
          "인용문": "고지의무라는 게 있어서, 지금 앓고 계신 병이나 과거 병력, 최근에 병원 다니신 이력 같은 걸 청약서에 사실대로 적어주셔야 해요."
        },
        {
          "대화ID": "U25",
          "인용문": "저희가 해피콜이라고 완전판매 확인 전화를 드릴 거예요. 오늘 안내 내용 제대로 들으셨는지 다시 한번 확인하는 거예요."
        }
      ]
    },
    {
      "항목코드": "B3",
      "충족수준": "충족",
      "배점": 6,
      "획득점수": 6,
      "근거": [
        {
          "대화ID": "U13",
          "인용문": "고객님 상황에 맞는 상품 안내드릴게요. 원금을 지키면서 모으고 싶으시다면 저희 한빛 저축보험이 잘 맞을 것 같아요."
        }
      ]
    },
    {
      "항목코드": "B4",
      "충족수준": "충족",
      "배점": 6,
      "획득점수": 6,
      "근거": []
    },
    {
      "항목코드": "C1",
      "충족수준": "충족",
      "배점": 6,
      "획득점수": 6,
      "근거": [
        {
          "대화ID": "U03",
          "인용문": "네, 자녀분 교육비 목적으로 알아보시는 거군요."
        },
        {
          "대화ID": "U11",
          "인용문": "맞아요, 원금 보전이 중요하신 거군요."
        }
      ]
    },
    {
      "항목코드": "C2",
      "충족수준": "충족",
      "배점": 6,
      "획득점수": 6,
      "근거": []
    },
    {
      "항목코드": "C3",
      "충족수준": "해당없음",
      "배점": 6,
      "획득점수": 0,
      "근거": []
    },
    {
      "항목코드": "D1",
      "충족수준": "충족",
      "배점": 7,
      "획득점수": 7,
      "근거": [
        {
          "대화ID": "U13",
          "인용문": "이 상품은 만기가 10년이라"
        },
        {
          "대화ID": "U15",
          "인용문": "공시이율이라고 해서요, 시장 상황에 따라 조금씩 달라지는 이율이 있는데 지금 연 3.0%로 운용돼요. 최소 1.0%는 보증이 돼서 원금 손실은 없고요. 10년 만기면 납입하신 원금에 이자가 붙어서 돌아오는 구조입니다."
        },
        {
          "대화ID": "U17",
          "인용문": "월 30만 원이나 50만 원 중에 고르실 수 있어요. 30만 원 기준으로 보시면 만기에 원금 플러스 이자 수령하시는 거고, 혹시 기간 중에 사망하시는 경우엔 기납입 보험료의 101%가 지급돼요."
        },
        {
          "대화ID": "U19",
          "인용문": "중간에 해지하시면 납입하신 금액보다 적게 받으실 수 있어요. 3년 시점에 해지하시면 납입액의 약 82% 수준이고요, 7년은 돼야 원금 수준으로 올라와요."
        }
      ]
    },
    {
      "항목코드": "D2",
      "충족수준": "충족",
      "배점": 5,
      "획득점수": 5,
      "근거": [
        {
          "대화ID": "U03",
          "인용문": "네, 자녀분 교육비 목적으로 알아보시는 거군요."
        },
        {
          "대화ID": "U05",
          "인용문": "아이가 지금 몇 살이고 언제쯤 쓰실 생각이세요?"
        },
        {
          "대화ID": "U07",
          "인용문": "혹시 그 전에 급하게 목돈 쓰실 일은 없으신가요?"
        },
        {
          "대화ID": "U09",
          "인용문": "원금이 좀 줄어드는 건 괜찮으신 편인가요, 아니면 납입하신 금액은 지켜지길 원하세요?"
        },
        {
          "대화ID": "U11",
          "인용문": "혹시 지금 한빛생명이나 다른 곳에 가입된 보험이 있으신가요?"
        },
        {
          "대화ID": "U13",
          "인용문": "원금을 지키면서 모으고 싶으시다면 저희 한빛 저축보험이 잘 맞을 것 같아요."
        }
      ]
    },
    {
      "항목코드": "D3",
      "충족수준": "충족",
      "배점": 5,
      "획득점수": 5,
      "근거": [
        {
          "대화ID": "U21",
          "인용문": "고지의무라는 게 있어서, 지금 앓고 계신 병이나 과거 병력, 최근에 병원 다니신 이력 같은 걸 청약서에 사실대로 적어주셔야 해요. 혹시라도 빠뜨리거나 다르게 쓰시면 나중에 보험금을 못 받거나 계약이 해지될 수 있거든요."
        }
      ]
    },
    {
      "항목코드": "D4",
      "충족수준": "충족",
      "배점": 4,
      "획득점수": 4,
      "근거": [
        {
          "대화ID": "U23",
          "인용문": "저축보험은 면책기간은 따로 없어요. 다만 고의나 자해로 인한 사고는 보험금이 지급이 안 되는 경우가 있고요"
        }
      ]
    },
    {
      "항목코드": "D5",
      "충족수준": "충족",
      "배점": 4,
      "획득점수": 4,
      "근거": [
        {
          "대화ID": "U25",
          "인용문": "청약하신 이후로 15일 이내에는 청약 철회가 가능해요. 그 안에 마음이 바뀌시면 납입하신 보험료 전액 돌려드리고요. 또 계약 성립되면 3영업일 안에 저희가 해피콜이라고 완전판매 확인 전화를 드릴 거예요."
        }
      ]
    },
    {
      "항목코드": "D6",
      "충족수준": "충족",
      "배점": 5,
      "획득점수": 5,
      "근거": []
    },
    {
      "항목코드": "E1",
      "충족수준": "충족",
      "배점": 7,
      "획득점수": 7,
      "근거": [
        {
          "대화ID": "U27",
          "인용문": "오늘 안내 내용 정리해드릴게요. 고객님은 자녀 교육비 목적이시고 원금 보전을 원하셔서, 한빛 저축보험 10년 만기에 월 30만 원 납입으로 모으셔서 만기에 받으신 목돈을 대학 자금으로 쓰시는 플랜으로 안내드렸어요. 중간 해지 시엔 납입액보다 적게 받으실 수 있고, 고지의무 사실대로 작성, 청약철회는 15일 이내 가능합니다. 더 궁금하신 점 있으세요?"
        }
      ]
    },
    {
      "항목코드": "E2",
      "충족수준": "충족",
      "배점": 7,
      "획득점수": 7,
      "근거": [
        {
          "대화ID": "U29",
          "인용문": "추가 문의 있으시면 고객센터 1588-1234로 전화 주시거나 홈페이지 채팅 상담 이용하시면 됩니다. 좋은 하루 되세요, 고객님."
        }
      ]
    }
  ],
  "판매정보": {
    "권유상품코드": "P3",
    "권유상품명": "한빛 저축보험",
    "니즈시나리오코드": "N3",
    "확인절차": {
      "가입목적": true,
      "재정상황": true,
      "기존계약": true
    },
    "매칭판정": "적합",
    "판정근거": "고객의 니즈(자녀 교육비 마련, 10~15년 기간, 원금 보전 선호, 단기 목돈 필요 없음)가 니즈 시나리오 N3에 해당하며, 상담사가 권유한 한빛 저축보험(P3)은 매칭표상 N3에 '적합'한 상품입니다. 상담사는 가입목적, 재정상황, 기존계약 확인 절차를 모두 수행했습니다."
  },
  "위험플래그": [],
  "집계": {
    "원점수합": 94,
    "적용배점합": 94,
    "환산총점": 100,
    "위험표시여부": false,
    "상태라벨": "정상"
  },
  "고객만족": {
    "등급": "만족",
    "점수": null,
    "근거": "고객이 상담 내용에 대해 \"다 이해했어요. 청약 진행할게요.\" (U28)라고 말하며 만족감을 표현하고 청약을 요청했습니다."
  },
  "요약": "고객은 자녀 교육비 마련을 위해 원금 보전이 가능한 저축보험 가입을 문의했습니다. 상담사는 고객의 니즈(자녀 연령, 목표 기간, 원금 보전 선호, 단기 유동성 필요 여부, 기존 보험 가입 여부)를 상세히 파악한 후 한빛 저축보험(P3)을 추천했습니다. 상품의 주요 내용(만기, 이율, 보험료, 사망 시 지급), 해지환급금의 원금 손실 가능성, 고지의무, 청약철회 및 해피콜 등 중요사항을 정확하고 이해하기 쉽게 설명했습니다. 고객은 모든 설명을 이해하고 청약을 진행하기로 결정했습니다.",
  "종합피드백": "상담사는 상담 도입부터 마무리까지 모든 절차를 완벽하게 수행했습니다. 고객의 니즈를 정확히 파악하고, 이에 적합한 상품을 추천하며, 상품의 중요 정보를 정확하고 이해하기 쉽게 설명했습니다. 특히, 중간 해지 시 원금 손실 가능성 등 고객에게 중요한 정보를 명확히 고지하여 불완전판매 요소를 사전에 차단했습니다. 친절한 태도와 효율적인 상담 진행으로 고객 만족도가 매우 높았던 우수 상담 사례입니다.",
  "평가메타": {
    "평가주체": "AI_1차",
    "AI모델": "gemini-2.5-flash",
    "루브릭버전": "v1.5",
    "평가일시": "2026-07-03T23:11:20.072Z"
  }
}