{
  "상담ID": "C-2026-018442",
  "평가메타": {
    "평가주체": "AI_1차",
    "AI모델": "claude-opus-4-8",
    "루브릭버전": "v1.5",
    "평가일시": "2026-06-20T10:14:32+09:00"
  },
  "분류": {
    "상담유형": "해지·환급",
    "유형근거": "고객이 기존 종신보험의 해지환급금 조회 및 해지 절차를 문의함.",
    "권유유형": "유지·해지방어·승환",
    "권유근거": "신규판매·승환은 없으나, 즉시 해지를 막으려 납입유예를 권유함(유지·해지방어). → D1~D5는 N/A, D6는 평가."
  },
  "판매정보": null,
  "항목평가": [
    {
      "항목코드": "A1",
      "충족수준": "충족",
      "배점": 4,
      "획득점수": 4,
      "근거": [{ "대화ID": "C-2026-018442-002", "인용문": "안녕하세요, 한빛생명 고객센터 상담사 이서연입니다." }],
      "코멘트": "소속·성명 명확히 고지."
    },
    {
      "항목코드": "A2",
      "충족수준": "충족",
      "배점": 4,
      "획득점수": 4,
      "근거": [{ "대화ID": "C-2026-018442-004", "인용문": "본인 확인을 위해 성함과 생년월일 말씀 부탁드립니다." }],
      "코멘트": "본인 계약 건이라 본인확인 수행, 적절."
    },
    {
      "항목코드": "A3",
      "충족수준": "충족",
      "배점": 4,
      "획득점수": 4,
      "근거": [{ "대화ID": "C-2026-018442-007", "인용문": "그러면 지금 가입하신 종신보험을 해지하고 싶으신 거죠?" }],
      "코멘트": "용건 되물어 정확히 파악."
    },
    {
      "항목코드": "B1",
      "충족수준": "충족",
      "배점": 8,
      "획득점수": 8,
      "근거": [{ "대화ID": "C-2026-018442-010", "인용문": "현재 해지환급금은 납입원금보다 약 80만 원 적은 320만 원으로 조회됩니다." }],
      "코멘트": "환급금·원금 손실 사실을 정확히 안내."
    },
    {
      "항목코드": "B2",
      "충족수준": "부분충족",
      "배점": 6,
      "획득점수": 3,
      "근거": [{ "대화ID": "C-2026-018442-010", "인용문": "해지환급금은 320만 원입니다." }],
      "코멘트": "'해지환급금' 용어를 풀어주지 않아 고객이 한 번 되물음. 설명 시도는 있었으나 불충분."
    },
    {
      "항목코드": "B3",
      "충족수준": "충족",
      "배점": 6,
      "획득점수": 6,
      "근거": [{ "대화ID": "C-2026-018442-014", "인용문": "당장 해지보다, 보험료 납입을 잠시 멈추는 납입유예도 가능하신데 안내드릴까요?" }],
      "코멘트": "해지 외 대안(납입유예) 제시."
    },
    {
      "항목코드": "B4",
      "충족수준": "충족",
      "배점": 6,
      "획득점수": 6,
      "근거": [{ "대화ID": "C-2026-018442-016", "인용문": "조회에 잠시만 양해 부탁드립니다. (10초) 확인되었습니다." }],
      "코멘트": "보류 시 사전 양해, 불필요한 반복 없음."
    },
    {
      "항목코드": "C1",
      "충족수준": "충족",
      "배점": 6,
      "획득점수": 6,
      "근거": [{ "대화ID": "C-2026-018442-011", "인용문": "원금보다 적게 돌려받으시게 되어 많이 아쉬우시겠어요." }],
      "코멘트": "고객 상황에 적절한 공감 멘트."
    },
    {
      "항목코드": "C2",
      "충족수준": "충족",
      "배점": 6,
      "획득점수": 6,
      "근거": [{ "대화ID": "C-2026-018442-013", "인용문": "고객님, 천천히 말씀 주셔도 괜찮습니다." }],
      "코멘트": "경어·정중한 호칭 일관."
    },
    {
      "항목코드": "C3",
      "충족수준": "충족",
      "배점": 6,
      "획득점수": 6,
      "근거": [{ "대화ID": "C-2026-018442-012", "인용문": "손해 보는 느낌이라 속상하시죠. 불편드려 죄송합니다. 다른 방법도 함께 살펴볼게요." }],
      "코멘트": "고객이 원금손실에 불만 표출 → 사과·공감·해결 순서로 대응. (감정 표출 있어 적용)"
    },
    {
      "항목코드": "D1",
      "충족수준": "해당없음",
      "배점": 7,
      "획득점수": 0,
      "근거": [],
      "코멘트": "신규 권유 없음 → N/A."
    },
    {
      "항목코드": "D2",
      "충족수준": "해당없음",
      "배점": 5,
      "획득점수": 0,
      "근거": [],
      "코멘트": "신규 권유 없음 → N/A."
    },
    {
      "항목코드": "D3",
      "충족수준": "해당없음",
      "배점": 5,
      "획득점수": 0,
      "근거": [],
      "코멘트": "신규 권유 없음 → N/A."
    },
    {
      "항목코드": "D4",
      "충족수준": "해당없음",
      "배점": 4,
      "획득점수": 0,
      "근거": [],
      "코멘트": "신규 권유 없음 → N/A."
    },
    {
      "항목코드": "D5",
      "충족수준": "해당없음",
      "배점": 4,
      "획득점수": 0,
      "근거": [],
      "코멘트": "신규 권유 없음 → N/A."
    },
    {
      "항목코드": "D6",
      "충족수준": "충족",
      "배점": 5,
      "획득점수": 5,
      "근거": [{ "대화ID": "C-2026-018442-014", "인용문": "당장 해지보다, 보험료 납입을 잠시 멈추는 납입유예도 가능하신데 안내드릴까요?" }],
      "코멘트": "납입유예 권유(유지·해지방어)가 있어 D6 평가 대상. 허위·과장·강요 없이 정상적 대안 제시 → 충족."
    },
    {
      "항목코드": "E1",
      "충족수준": "충족",
      "배점": 7,
      "획득점수": 7,
      "근거": [{ "대화ID": "C-2026-018442-019", "인용문": "정리하면 오늘은 해지 보류하고 납입유예 신청하신 거예요. 더 궁금하신 점 없으실까요?" }],
      "코멘트": "처리내용 요약·이해 점검."
    },
    {
      "항목코드": "E2",
      "충족수준": "충족",
      "배점": 7,
      "획득점수": 7,
      "근거": [{ "대화ID": "C-2026-018442-021", "인용문": "추가 문의는 고객센터나 앱으로 가능합니다. 이용해 주셔서 감사합니다." }],
      "코멘트": "추가 채널 안내 + 정중한 종료."
    }
  ],
  "위험플래그": [],
  "집계": {
    "원점수합": 72,
    "적용배점합": 75,
    "환산총점": 96.0,
    "위험표시여부": false,
    "상태라벨": "정상"
  },
  "고객만족": {
    "등급": "만족",
    "점수": null,
    "근거": "원금손실에 초기 불만이 있었으나, 납입유예 대안 안내 후 '그 방법으로 할게요'라며 수긍."
  },
  "요약": "종신보험 해지·환급금 문의 건. 원금손실 사실을 정확히 안내하고 납입유예 대안을 제시하여 즉시 해지를 보류시킴. 신규 권유 없음(D1~D5 N/A), 납입유예는 유지권유라 D6만 평가·충족.",
  "종합피드백": "해지환급금 등 전문용어를 처음 언급할 때 한 줄로 풀어 설명하면 B2 충족 수준까지 올릴 수 있습니다. 대안 제시와 감정 대응은 우수했습니다."
}
